Uuid,Role name,Description,Inherited roles,Privileges,_order:1000
b1ad7622-9548-4c0e-a137-17ea4a2d892a,o3 Clinician,o3 Clinician to provide care to patient,,o3: View Patient Chart;o3: View Medications;o3: View Visits;o3: View Allergies;o3: View Conditions;o3: View Immunizations;o3: View Attachments;o3: View Patient Chart Appointments;o3: View Care Panels;o3: View Investigative Results;o3: View MCH;o3: View HTS;o3: View Default Tracing;o3: View Family History;o3: View Service Queues;o3: View Appointments;o3: View In-Patient;o3: View Bed Management;o3: View Patient Forms;o3: View Notes;o3: View Test Results;o3: View Vitals and Biometrics;o3: View Labour And Delivery;o3: View Lab Results;o3: View Patient Flags;o3: View Clinical Views;o3: View Patient Chart Test Results;o3: Manage Procedures,
138cc888-2b25-4237-b835-34bd5720f9eb,o3 Cashier,Manage billing and financial transaction,API Privileges,o3: View Patient Chart Bill History;o3: View Billing;o3: Manage Bills,
eb813734-73f5-40d6-ac4a-b35574a148ef,o3 Stock Manager,o3: Manage stock Items,,o3: Manage Stocks,
88671df1-37cb-4617-912e-361bec8d1a97,o3 Pharmacy,o3: Dispense medication,,o3: View Dispensing,
7e20eb54-3749-42ae-9f80-999e14f5d322,o3 Lab Tech,o3: Lab tech to perform and key in lab results,,o3: View Lab Results;o3: View Labs,
c89190eb-af21-436c-adbd-c3b24f8a5a11,Community Pharmacy,Manage Community Pharmacy dispensing,,Manage Community Pharmacy,