Uuid,Privilege name,Description,_order
4ed00cb4-fa6a-400b-99c6-b4388118219d,o3: View Procedure Order,Create a new procedure order,
76af4f9e-08be-4b32-b868-884da844c8c9,o3: Fill Procedure Result Form,Fill out the procedure result form,
9bb6f116-df93-40d3-85a9-a4520cae63f4,o3: Pick Procedure Order,Select a procedure order to work on,
f2555bed-2f8c-4e02-af4d-38b0311fd9b8,o3: View Procedure Dashboard,View the procedure dashboard,
23077ff2-29db-4881-b5bd-5680cd00956f,o3: View Medical Supply Order Form,View the medical supply order form,
