Uuid,Privilege name,Description,_order:1000
b711f0ae-a25e-4188-9f45-89c94e949ee3,o3: View Appointments Dashboard,Allows access to view the appointments dashboard,
89c44d36-834b-4f02-846a-27914eadcf21,o3: Create Appointments,Permits creating new appointments in the system,
ad429e15-83a8-480a-aa59-799b1dce7ad9,o3: Edit Appointments,Enables editing existing appointments,
566ab4c1-5f65-4119-968b-1b6c59642fe4,o3: Delete Appointments,Allows deletion of appointments from the system,
7dc9db08-0fc0-4fb0-8fd8-f9d1f95ed2cf,o3: View Patient Chart Appointments,Provides access to view appointments in patient charts,